<?xml version="1.0" encoding="UTF-8"?>
<!DOCTYPE canciones SYSTEM "1.Canciones.dtd">
<canciones>
  <cancion titulo="VideoKilledTheRadioStar">
    <duracion>4.08</duracion>
    <año>1979</año>
    <compositores>
      <compositor>
        <nombre>Geoff</nombre>
        <apellidos>Downes</apellidos>
      </compositor>
      <compositor>
        <nombre>Trevor</nombre>
        <apellidos>Horn</apellidos>
      </compositor>
      <compositor>
        <nombre>Bruce</nombre>
        <apellidos>Woolley</apellidos>
      </compositor>
    </compositores>
    <disco>The Age of Plastic</disco>
    <sello>Island</sello>
    <artistas>
      <artista>Buggles</artista>
    </artistas>
  </cancion>
</canciones>
